,article_id,author,category,number_of_comments,timestamp,title,article_link
340,473959,هسبريس من الرباط,medias,9,2020-06-07 06:02:00,"""الهاكا"" تتوصل بـ80 شكاية حول برامج رمضان",https://www.hespress.com/medias/473959.html
341,479940,هسبريس من الرباط,economie,6,2020-08-01 23:37:00,الأصول الاحتياطية الرسمية تصل 293 مليار درهم,https://www.hespress.com/economie/479940.html
342,473961,هسبريس من الرباط,medias,46,2020-06-06 22:00:00,"رصيف الصحافة: الملك يتخذ من ""قصر الصخيرات"" إقامة رئيسية",https://www.hespress.com/medias/473961.html
343,474030,هسبريس من الرباط,medias,20,2020-06-07 14:00:00,"مجلس الصحافة يرصد اختلالات التعاطي مع ""كوفيد-19"" في المغرب",https://www.hespress.com/medias/474030.html
344,473910,يوسف لهلالي من باريس,medias,23,2020-06-07 07:00:00,رحيل الزعيم عبد الرحمان اليوسفي .. صحافي مناضل وقارئ نهم,https://www.hespress.com/medias/473910.html
345,474022,هسبريس من الرباط,medias,16,2020-06-07 15:10:00,صحفيون يطالبون بمحاكمة الريسوني في حالة سراح,https://www.hespress.com/medias/474022.html
346,474098,هسبريس من الرباط,medias,50,2020-06-07 22:00:00,رصيف الصحافة: اختبارات كورونا لأجراء القطاع الخاص غير مجانية,https://www.hespress.com/medias/474098.html
347,474186,هسبريس من الرباط,medias,20,2020-06-08 19:22:00,سيدة تنفي تعرضها للضغط في مواجهة الريسوني,https://www.hespress.com/medias/474186.html
348,474357,هسبريس ـ وائل بورشاشن,medias,9,2020-06-10 11:55:00,صحافيون وحقوقيون يطلبون العدالة بملف الريسوني,https://www.hespress.com/medias/474357.html
349,474373,هسبريس من الرباط,medias,2,2020-06-10 18:25:00,حملة تشخيص كورونا تستهدف العاملين في الصحافة,https://www.hespress.com/medias/474373.html
350,474326,هسبريس من الرباط,medias,28,2020-06-09 22:00:00,"رصيف الصحافة: تجربة على مرضى ""كورونا"" تثير جدلا في طنجة",https://www.hespress.com/medias/474326.html
351,474451,هسبريس من الرباط,medias,37,2020-06-10 22:00:00,"رصيف الصحافة: التعايش الإجباري مع ""كوفيد-19"" ينتظر المغاربة",https://www.hespress.com/medias/474451.html
352,474205,هسبريس من الرباط,medias,101,2020-06-08 22:00:00,رصيف الصحافة: جدل رفع الحجر الصحي يتواصل في المغرب,https://www.hespress.com/medias/474205.html
353,474397,هسبريس من الدار البيضاء,medias,14,2020-06-10 15:20:00,النيابة ترفض دفوعات محاميي الصحافي الريسوني,https://www.hespress.com/medias/474397.html
354,474372,هسبريس من الرباط,medias,6,2020-06-11 02:25:00,توقيعات تدعو إلى الإفراج عن الصحافي الريسوني,https://www.hespress.com/medias/474372.html
355,474563,هسبريس من الرباط,medias,48,2020-06-11 22:00:00,"رصيف الصحافة: مواجهة ""كورونا"" تؤجل فتح المساجد في المملكة",https://www.hespress.com/medias/474563.html
356,474616,هسبريس من الرباط,medias,3,2020-06-12 15:15:00,"""دار البريهي"" تعزز بروتوكول الحماية من كورونا",https://www.hespress.com/medias/474616.html
357,474877,هسبريس من الرباط,medias,11,2020-06-14 22:30:00,رصيف الصحافة: الدرك يضبط سلاحا ناريا ورصاصا حيا بواد إفران,https://www.hespress.com/medias/474877.html
358,474661,هسبريس من الرباط,medias,24,2020-06-12 22:35:00,"رصيف الصحافة: أطباء يحذرون من مخاطر ""الحجر"" على الأطفال",https://www.hespress.com/medias/474661.html
359,474741,هسبريس من الرباط,medias,105,2020-06-13 21:00:00,رصيف الصحافة: غضبة ملكية تطال مسؤولي مدينة الصخيرات,https://www.hespress.com/medias/474741.html
360,479941,هسبريس من الرباط,economie,1,2020-08-02 08:37:00,"""بورصة البيضاء"" تواصل الأداء السلبي بـ 16%",https://www.hespress.com/economie/479941.html
361,479816,هسبريس من الرباط,economie,16,2020-07-31 13:34:00,بنموسى: التكامل الاقتصادي يجمع المغرب وفرنسا,https://www.hespress.com/economie/479816.html
362,479644,هسبريس من الرباط,economie,9,2020-07-31 17:00:00,"العمال غير المُؤَهَّلين أكبر ضحايا التسريح ""زمن كورونا"" بالمغرب",https://www.hespress.com/economie/479644.html
363,479916,هسبريس من الرباط,economie,27,2020-08-02 09:00:00,"الحكومة تبحث زيادة الأجور بالمقاولات الأقل تضررا من ""كورونا""",https://www.hespress.com/economie/479916.html
364,479939,هسبريس من الرباط,economie,3,2020-08-02 13:24:00,الدرهم ينخفض أمام الأورو ويرتفع مقابل الدولار,https://www.hespress.com/economie/479939.html
365,479891,هسبريس من الرباط,economie,4,2020-08-02 10:10:00,شركة بريطانية تُعالج المياه العادمة بمدينة طرفاية,https://www.hespress.com/economie/479891.html
366,480045,هسبريس من الدار البيضاء,economie,10,2020-08-03 09:00:00,مقاولات تراهن على الاستثمار العمومي لإنعاش الاقتصاد المغربي,https://www.hespress.com/economie/480045.html
367,480032,هسبريس من الرباط,economie,27,2020-08-02 21:15:00,"مغربيتان ضمن قائمة ""فوربس"" للسيدات الرائدات",https://www.hespress.com/economie/480032.html
368,480025,هسبريس - محمد الراجي,economie,66,2020-08-02 22:00:00,زيادة جديدة تُنعش أجور الطبقة العاملة والعاملات والعمال المنزليين,https://www.hespress.com/economie/480025.html
369,480029,هسبريس من الرباط,economie,11,2020-08-03 07:54:00,"""فيدرالية النقل السياحي"" تنفي الإضراب المفتوح",https://www.hespress.com/economie/480029.html
370,480118,هسبريس من الرباط,economie,5,2020-08-03 21:37:00,بنك المغرب يتعقّب آلاف الأوراق النقدية المزورة,https://www.hespress.com/economie/480118.html
371,480128,هسبريس من الرباط,economie,15,2020-08-04 01:25:00,"جامعي مغربي يحلل عِلْم ""الاقتصاد الكُلِّي"" في زمن جائحة ""كورونا""",https://www.hespress.com/economie/480128.html
372,480079,هسبريس من الرباط,economie,9,2020-08-04 04:55:00,عدم استقرار الإنتاج من المصادر الخضراء يتحدى الطاقة بالمغرب,https://www.hespress.com/economie/480079.html
373,480238,هسبريس من الرباط,economie,1,2020-08-05 01:10:00,لأول مرة .. سعر الذهب يتجاوز حاجز 2000 دولار,https://www.hespress.com/economie/480238.html
374,480177,هسبريس - يوسف لخضر,economie,35,2020-08-05 02:50:00,"الدولة تقرر إدماج مؤسسات عمومية والتخلي عن ""مقاولات متجاوزة""",https://www.hespress.com/economie/480177.html
375,480148,هسبريس من الرباط,economie,7,2020-08-04 11:05:00,"""كابل كهربائي"" يستنفر المغرب وإسبانيا تحت البحر",https://www.hespress.com/economie/480148.html
376,480170,هسبريس - يوسف لخضر (صور: منير امحيمدات),economie,47,2020-08-04 14:00:00,بنشعبون يكشف تفاصيل خطة إنعاش اقتصادي بقيمة 120 مليار درهم,https://www.hespress.com/economie/480170.html
377,473792,هسبريس من الرباط,marocains-du-monde,43,2020-06-05 00:13:00,مرض مزمن ينهي حياة مغربي عالق بدولة الفلبين‎,https://www.hespress.com/marocains-du-monde/473792.html
378,473614,هسبريس - مصطفى شاكري,marocains-du-monde,46,2020-06-05 02:00:00,إحسان ليكي .. مرشحة مغربية للكونغرس تكسب ثقة الأمريكيين,https://www.hespress.com/marocains-du-monde/473614.html
379,473692,هسبريس من الرباط,marocains-du-monde,49,2020-06-05 15:00:00,رسوم الدراسة والإقامة تهدد طلبة مغاربة بالطرد من جامعات أوكرانية,https://www.hespress.com/marocains-du-monde/473692.html
380,473787,هسبريس من الرباط,marocains-du-monde,21,2020-06-05 10:07:00,الحكومة الألمانية تقدم دعمًا ماليًّا للطلبة المغاربة‎,https://www.hespress.com/marocains-du-monde/473787.html
381,473813,هسبريس من الرباط,marocains-du-monde,45,2020-06-05 11:30:00,"""الخارجية"" توضح بشأن وفاة مغربي مقيم في الفلبين",https://www.hespress.com/marocains-du-monde/473813.html
382,473822,هسبريس - أمال كنين,marocains-du-monde,27,2020-06-06 03:55:00,مغاربة عالقون يدخلون في إضراب عن الطعام‬,https://www.hespress.com/marocains-du-monde/473822.html
383,473852,عبد السلام الشامخ من إسطنبول,marocains-du-monde,52,2020-06-05 21:00:00,"مغربيات عالقات بإسطنبول يتأهّبن للولادة في تجربة ""استثنائية""",https://www.hespress.com/marocains-du-monde/473852.html
384,473693,هسبريس - أمال كنين,marocains-du-monde,3,2020-06-06 10:10:00,"اتحاد إسباني ينادي بمرصد لـ""عاملات الفراولة""",https://www.hespress.com/marocains-du-monde/473693.html
385,473923,هسبريس ـ مُتابعة,marocains-du-monde,8,2020-06-06 16:06:00,السفير الناصري: تم التكفل بالمغاربة العالقين بمالي,https://www.hespress.com/marocains-du-monde/473923.html
386,473917,هسبريس - أمال كنين ,marocains-du-monde,20,2020-06-08 08:38:00,محامون بالخارج يطلبون إنهاء معاناة مغاربة عالقين‎,https://www.hespress.com/marocains-du-monde/473917.html
387,473747,هسبريس - نور الدين إكجان,marocains-du-monde,64,2020-06-06 09:00:00,"""تعليقات كورونية مسيئة"" تزيد من إحباط مغاربة عالقين بالخارج",https://www.hespress.com/marocains-du-monde/473747.html
388,474062,هسبريس من الرباط,marocains-du-monde,3,2020-06-08 04:40:00,خلية تقدم المساعدة للمغاربة العالقين بالبرازيل‎,https://www.hespress.com/marocains-du-monde/474062.html
389,474144,عبد السلام الشامخ من إسطنبول,marocains-du-monde,38,2020-06-09 07:00:00,الإجهاض يتربّصُ بمغربيات عالقات بتركيا .. قلق وخوف وضغوطات‎,https://www.hespress.com/marocains-du-monde/474144.html
390,474333,هسبريس من الرباط,marocains-du-monde,28,2020-06-09 23:04:00,عملية إرجاع المغاربة العالقين في إسبانيا تنطلق من مطار مالقا,https://www.hespress.com/marocains-du-monde/474333.html
391,474279,هسبريس - عبد الرحيم العسري,marocains-du-monde,114,2020-06-09 16:30:00,"رسميا .. بوريطة يعلن برنامج عودة ""المغاربة العالقين"" في الخارج",https://www.hespress.com/marocains-du-monde/474279.html
392,474293,عبد السلام الشامخ من إسطنبول,marocains-du-monde,34,2020-06-10 13:00:00,"إغلاق الحدود التركية اليونانية يدفع ""حراكة"" مغاربة إلى طلب العودة‬",https://www.hespress.com/marocains-du-monde/474293.html
393,474310,هسبريس - عبد الرحيم العسري,marocains-du-monde,127,2020-06-10 03:00:00,"وزير الخارجية يُوضح مصير عملية ""مرحبا 2020"" أمام ترقب الجالية",https://www.hespress.com/marocains-du-monde/474310.html
394,474299,هسبريس - عبد الرحيم العسري,marocains-du-monde,54,2020-06-10 05:15:00,أزيد من 30 ألف مغربي عالقين بالمملكة غادروا إلى دول المهجر,https://www.hespress.com/marocains-du-monde/474299.html
395,477374,هسبريس من الرباط,art-et-culture,1,2020-07-08 07:02:00,"صلاح بوسريف يصدر ""بيانات في حداثة الكتابة""",https://www.hespress.com/art-et-culture/477374.html
396,476915,هسبريس - وائل بورشاشن,art-et-culture,12,2020-07-06 04:00:00,"غياب دعم وزارة الثقافة يدفع فنّاني الشارع إلى ""الاحتجاج الرقمي""",https://www.hespress.com/art-et-culture/476915.html
397,477380,إبراهيم مغراوي من مراكش,art-et-culture,14,2020-07-07 22:07:00,"صحة عبد الجبار الوزير تتجاوز ""مرحلة الخطر""",https://www.hespress.com/art-et-culture/477380.html
398,474422,هسبريس من الرباط,marocains-du-monde,22,2020-06-10 19:25:00,رحلات جديدة تعيد مغاربة عالقين بإسبانيا يوم الجمعة,https://www.hespress.com/marocains-du-monde/474422.html
399,477232,هسبريس من الرباط,art-et-culture,5,2020-07-07 06:00:00,"""بيت ياسين"" يُعيد الشاعر العراقي فاضل العزاوي إلى منزله القديم",https://www.hespress.com/art-et-culture/477232.html
400,477344,هسبريس من الرباط,art-et-culture,6,2020-07-09 05:00:00,"القاعات السينمائية تستعدّ لاستقبال رواد ""الفن السابع"" في المغرب",https://www.hespress.com/art-et-culture/477344.html
401,477529,هسبريس من الرباط,art-et-culture,4,2020-07-10 05:06:00,أزوكار يلمّ قرارات محكمة النقض في مؤلف جديد,https://www.hespress.com/art-et-culture/477529.html
402,477259,هسبريس - وائل بورشاشن,art-et-culture,7,2020-07-10 06:00:00,"دار نشر مغربية تشجّع القراءة بـ""قصص بوليسية وجماعات سرية""",https://www.hespress.com/art-et-culture/477259.html
403,477640,هسبريس من الرباط,art-et-culture,0,2020-07-11 01:42:00,"ليلة ""السينما البيضاء"" تنتقل إلى العالَم الرقمي",https://www.hespress.com/art-et-culture/477640.html
404,477711,هسبريس من الرباط,art-et-culture,109,2020-07-11 01:40:00,الممثل المغربي عبد العظيم الشناوي في ذمة الله,https://www.hespress.com/art-et-culture/477711.html
405,477690,عبد العزيز كوكاس,art-et-culture,4,2020-07-11 06:00:00,"كوكاس يقتفي بقايا ""الحامض النووي للرجل"" في الكتابة النسائية",https://www.hespress.com/art-et-culture/477690.html
406,477692,هسبريس من الرباط,art-et-culture,0,2020-07-11 09:32:00,"بوطيب يكتب للأطفال ""رسمي في سلّة المُهمَلات""",https://www.hespress.com/art-et-culture/477692.html
407,477642,هسبريس من الرباط,art-et-culture,0,2020-07-11 06:55:00,"مؤسسة الصديقي تصدر ""رواق الثقافة والفنون""",https://www.hespress.com/art-et-culture/477642.html
408,477878,هسبريس من الرباط,art-et-culture,13,2020-07-12 19:03:00,"نتفليكس تعرض صور ""الحرس القديم"" في مراكش‎",https://www.hespress.com/art-et-culture/477878.html
409,477869,هسبريس من الرباط,art-et-culture,6,2020-07-12 17:35:00,مشاريع أفلام تستفيد من تسبيقات على المداخيل,https://www.hespress.com/art-et-culture/477869.html
410,477853,هسبريس من الرباط,art-et-culture,0,2020-07-13 05:13:00,"أمسية تحتفي بـ""حدائق الشعر"" في مدينة تطوان",https://www.hespress.com/art-et-culture/477853.html
411,481429,هسبريس من الرباط,faits-divers,0,2020-08-17 17:10:00,"تنظيم ""الهجرة السرية"" يورّط 3 أشخاص بالجديدة",https://www.hespress.com/faits-divers/481429.html
412,477855,هسبريس - عبد السلام الشامخ,art-et-culture,76,2020-07-13 01:15:00,"""الكريمي"" .. ""أبُ الفكاهة الشعبية"" يطوي صفحة ""الفرجة الماتعة""",https://www.hespress.com/art-et-culture/477855.html
413,481452,حميد رزقي,faits-divers,5,2020-08-17 20:01:00,"شبهة ""قتل تلميذ"" بأغبالة تجر قاصرا إلى القضاء",https://www.hespress.com/faits-divers/481452.html
414,477998,هسبريس من الرباط,art-et-culture,0,2020-07-14 01:08:00,"الروائي بيروك يوضح بخصوص جائزة ""أمادو أنداي""",https://www.hespress.com/art-et-culture/477998.html
415,477734,إبراهيم مغراوي من مراكش,art-et-culture,150,2020-07-11 13:05:00,"الفنان الفكاهي محمد ""الكريمي"" في ذمة الله",https://www.hespress.com/art-et-culture/477734.html
416,481417,هسبريس من الرباط,faits-divers,1,2020-08-18 01:23:00,"حجز شحنة من مخدر ""الشيرا"" ضواحي مدينة أكادير",https://www.hespress.com/faits-divers/481417.html
417,481427,صالح الخزاعي من خريبكة,faits-divers,11,2020-08-17 21:18:00,اعتداءات متكررة تُغضب سائقي طاكسيات خريبكة,https://www.hespress.com/faits-divers/481427.html
418,481494,هسبريس من طنجة,faits-divers,10,2020-08-18 12:10:00,"مداهمة تسقط مروّج كحول و""سليسيون"" في طنجة",https://www.hespress.com/faits-divers/481494.html
419,481514,رشيد بيجيكن من أكادير,faits-divers,6,2020-08-18 16:15:00,"""فوائد غير قانونية"" تطيح بإطار بنكي في بيوكرى‬",https://www.hespress.com/faits-divers/481514.html
420,481500,مصطفى البكار من تزنيت,faits-divers,7,2020-08-18 14:10:00,"النيران تلتهم ""مخيم المهاجرين"" وسط مدينة تزنيت",https://www.hespress.com/faits-divers/481500.html
421,481537,هسبريس من الرباط,faits-divers,8,2020-08-18 18:15:00,"الأمن يوضّح حقيقة ""تخريب طاكسيات"" بخريبكة",https://www.hespress.com/faits-divers/481537.html
422,481540,هسبريس من الرباط,faits-divers,3,2020-08-18 18:00:00,"انقلاب ""بيكوب"" يخلف مقتل شخص قرب ميسور",https://www.hespress.com/faits-divers/481540.html
423,481549,هسبريس من النّاظور,faits-divers,24,2020-08-18 22:28:00,سقوط من علوّ منزل يصرع صباغيْن في أزغنغان,https://www.hespress.com/faits-divers/481549.html
424,481567,هسبريس من الناظور,faits-divers,9,2020-08-19 00:11:00,العثورُ على رضيعة متخلّى عنها بمستشفى النّاظور,https://www.hespress.com/faits-divers/481567.html
425,481546,هسبريس من تطوان,faits-divers,1,2020-08-18 23:30:00,حريق غابوي قرب الفنيدق يستنفر سلطات العمالة,https://www.hespress.com/faits-divers/481546.html
426,481565,أيوب صدور من تطوان,faits-divers,8,2020-08-19 09:23:00,إصابة أفراد القوات المساعدة في حريق الفنيدق,https://www.hespress.com/faits-divers/481565.html
427,481616,هسبريس من الرباط,faits-divers,3,2020-08-19 17:05:00,دركيو السراغنة يفكون لغز سرقة 60 لوحة شمسية,https://www.hespress.com/faits-divers/481616.html
428,481646,رشيد الكويرتي,faits-divers,1,2020-08-20 04:40:00,"مصرع شاب غرقا في ""ضاية أفرط النجوم"" بتاونات",https://www.hespress.com/faits-divers/481646.html
429,481629,إبراهيم مغراوي من مراكش,faits-divers,12,2020-08-19 20:05:00,"""كوفيد - 19"" يخطف محاميا وملاكما في مراكش",https://www.hespress.com/faits-divers/481629.html
430,481648,مصطفى البكار,faits-divers,0,2020-08-20 01:57:00,تجارة الممنوعات تورط شابين ضواحي إقليم تزنيت,https://www.hespress.com/faits-divers/481648.html
431,481620,إبراهيم مغراوي من مراكش ,faits-divers,1,2020-08-20 06:49:00,ترويج المخدرات يجرّ شخصا إلى القضاء بمراكش,https://www.hespress.com/faits-divers/481620.html
432,481643,هسبريس من الناظور,faits-divers,2,2020-08-20 08:15:00,الدرك يحجز زوارق معدّة لتهريب المخدرات بأركمان,https://www.hespress.com/faits-divers/481643.html
433,477444,هسبريس من الرباط,politique,1,2020-07-09 05:35:00,البرلمان يحيل قانون البطاقة على مجلس بوعياش,https://www.hespress.com/politique/477444.html
434,477565,هسبريس من الرباط,politique,6,2020-07-09 19:01:00,"تمديد حالة ""الطوارئ الصحية"" إلى غاية 10 غشت",https://www.hespress.com/politique/477565.html
435,477451,هسبريس- مصطفى شاكري,politique,41,2020-07-08 23:00:00,الانتخابات المقبلة تنسج تنسيق أحزاب المعارضة في أفق 2021,https://www.hespress.com/politique/477451.html
436,477508,هسبريس - يوسف لخضر,politique,60,2020-07-09 13:00:00,البرلمانيون يطلبون رأي مجلس المنافسة حول أسعار التعليم الخصوصي,https://www.hespress.com/politique/477508.html
437,477725,هسبريس - أمال كنين ,politique,13,2020-07-11 12:12:00,إسبانيا تجلي 19 ألف شخص من المغرب منذ مارس,https://www.hespress.com/politique/477725.html
438,477570,هسبريس من الرباط,politique,106,2020-07-09 20:35:00,"بوريطة: قرار فتح حدود المملكة ""عملية استثنائية""",https://www.hespress.com/politique/477570.html
439,477455,هسبريس من الرباط,politique,112,2020-07-10 13:00:00,"""الجائحة"" تعيد مطالب تقليص أجور البرلمانيين والوزراء إلى الواجهة",https://www.hespress.com/politique/477455.html
440,477538,هسبريس من الرباط,politique,160,2020-07-09 15:12:00,حكومة العثماني تقرر تمديد حالة الطوارئ لشهر إضافي في المغرب,https://www.hespress.com/politique/477538.html
441,477743,هسبريس من الرباط,politique,47,2020-07-12 10:19:00,"زين الدين: هذه أسباب خرجات بنكيران ضد ""الإخوان""",https://www.hespress.com/politique/477743.html
442,477814,هسبريس من الرباط,politique,6,2020-07-12 11:10:00,"المصادقة على الجزء الأول من ""المالية المعدّلة""",https://www.hespress.com/politique/477814.html
443,477898,هسبريس من الرباط,politique,8,2020-07-12 23:05:00,عبد اللطيف وهبي يعقد لقاءين حزبيين بتازة والناظور‎,https://www.hespress.com/politique/477898.html
444,477941,هسبريس - محمد بلقاسم,politique,21,2020-07-13 17:00:00,المعارضة تتهم الحكومة بالارتباك والارتجالية في تدبير أزمة كورونا,https://www.hespress.com/politique/477941.html
445,477952,هسبريس - محمد بلقاسم,politique,64,2020-07-13 19:00:00,"دعم الوزير ""التكنوقراطي"" بنشعبون يقسم ""الأحرار"" بمجلس النواب",https://www.hespress.com/politique/477952.html
446,477936,هسبريس - محمد بلقاسم,politique,44,2020-07-13 14:00:00,"""البيجيدي"" يرفض التمييز بين الوزراء وربط الإخفاقات بأداء الحكومة",https://www.hespress.com/politique/477936.html
447,477976,هسبريس - محمد بلقاسم,politique,79,2020-07-13 23:00:00,"أخنوش ينتقد تشويش نواب ""البيجيدي"" على مخطط المغرب الأخضر",https://www.hespress.com/politique/477976.html
448,477930,هسبريس من الرباط,politique,2,2020-07-14 03:36:00,مجلس الحكومة يتتبع أزمة كورونا في قطاع السياحة,https://www.hespress.com/politique/477930.html
449,478014,هسبريس من الرباط,politique,5,2020-07-13 23:30:00,"مجلس النواب يصادق على ""قانون المالية المعدل""",https://www.hespress.com/politique/478014.html
450,477946,هسبريس من الرباط,politique,134,2020-07-13 20:00:00,"الرئيس الجزائري يحصرُ نزاع الصحراء بين المغرب و""البوليساريو""",https://www.hespress.com/politique/477946.html
451,477931,هسبريس - عبد الرحيم العسري,politique,51,2020-07-14 07:00:00,"هل يُمهد لقاء ""البام"" و""البيجيدي"" للتحالف في الانتخابات المقبلة؟",https://www.hespress.com/politique/477931.html
452,482688,إبراهيم الحافظون من سطات,regions,2,2020-08-31 05:36:00,"حملة تحسيس بكورونا تستهدف ""سوق حد مزورة""",https://www.hespress.com/regions/482688.html
453,482673,هسبريس من الرباط,regions,0,2020-08-31 04:22:00,توقعات الأرصاد الجوية لطقس اليوم الاثنين بالمغرب,https://www.hespress.com/regions/482673.html
454,482696,عبد الكريم هرواش من الناظور,regions,5,2020-08-31 05:19:00,"ثغر مليلية يعتمد ""التّعليم بالتناوب"" لتفادي الاكتظاظ",https://www.hespress.com/regions/482696.html
