,article_id,author,category,number_of_comments,timestamp,title,article_link
682,481112,هسبريس من الناظور,faits-divers,0,2020-08-13 13:20:00,حادثة سير مميتة تودي بحياة متشرّد في النّاظور,https://www.hespress.com/faits-divers/481112.html
683,481092,حميد رزقي من الفقيه بن صالح,faits-divers,1,2020-08-13 16:04:00,المخدرات تسبب توقيف عشريني بالفقيه بنصالح,https://www.hespress.com/faits-divers/481092.html
684,481079,إبراهيم مغراوي من مراكش,faits-divers,0,2020-08-13 14:45:00,مسكر ماء الحياة يسقط شخصا بيد أمن مراكش,https://www.hespress.com/faits-divers/481079.html
685,472983,هسبريس من الرباط,medias,51,2020-05-28 22:00:00,"رصيف الصحافة: ""كورونا"" يؤجّل عملية العبور إلى أجل غير مسمى",https://www.hespress.com/medias/472983.html
686,481067,إبراهيم مغراوي من مراكش,faits-divers,1,2020-08-13 19:40:00,السرقة بالعنف تسقط شخصا في يد أمن مراكش,https://www.hespress.com/faits-divers/481067.html
687,481063,عبد الكريم هرواش من الناظور,faits-divers,2,2020-08-13 16:25:00,"مشفى النّاظور يسجّل ثاني وفاة بسبب ""كورونا""",https://www.hespress.com/faits-divers/481063.html
688,472941,هسبريس من الرباط,medias,62,2020-05-29 00:00:00,"تعويضات ""مجلس الصحافة"" تثير جدلاً .. ومصدر مسؤول: ""معقولة""",https://www.hespress.com/medias/472941.html
689,481069,رشيد الكويرتي من فاس,faits-divers,6,2020-08-13 18:15:00,تخريب سيارات يطيح بأربعة أشخاص في فاس,https://www.hespress.com/faits-divers/481069.html
690,481077,رشيد الكويرتي من فاس,faits-divers,0,2020-08-13 21:42:00,محاولة إضرام النار تورط مبحوثا عنه وسط فاس,https://www.hespress.com/faits-divers/481077.html
691,481086,هسبريس - عبد الإله شبل,faits-divers,17,2020-08-13 20:00:00,"العطلة تطيل اعتقال نجلي زيان والنويضي بسبب ""الكمامات القاتلة""",https://www.hespress.com/faits-divers/481086.html
692,481109,مصطفى البكار من تزنيت,faits-divers,6,2020-08-14 00:26:00,مصرع فتاة عشرينية غرقا في شاطئ سيدي بونوار,https://www.hespress.com/faits-divers/481109.html
693,481098,مصطفى البكار,faits-divers,4,2020-08-13 23:04:00,"الوكيل العام يأمر بمتابعة مُعتدين على ""قاصر تزنيت""",https://www.hespress.com/faits-divers/481098.html
694,481071,رشيد بيجيكن من أكادير,faits-divers,15,2020-08-14 04:04:00,"توقيف ""مقدم"" متلبس بالارتشاء في آيت ملول",https://www.hespress.com/faits-divers/481071.html
695,481110,رشيد بيجيكن من أكادير,faits-divers,22,2020-08-14 12:05:00,أمن طانطان يشن حملة على الدراجات النارية‎,https://www.hespress.com/faits-divers/481110.html
696,481183,هسبريس من الرباط,faits-divers,16,2020-08-14 19:30:00,أمن البيضاء يوقف عشرينيا حاول اختطاف ضحية,https://www.hespress.com/faits-divers/481183.html
697,481179,إبراهيم مغراوي من مراكش ,faits-divers,5,2020-08-14 18:20:00,"تدخل الشرطة يحبط عملية ""سرقة بالعنف"" بمراكش",https://www.hespress.com/faits-divers/481179.html
698,481154,رشيد بيجيكن من أكادير,faits-divers,14,2020-08-14 23:33:00,شبهة الرشوة تجر قائداً إلى الاستنطاق بآيت ملول,https://www.hespress.com/faits-divers/481154.html
699,481186,هسبريس من فاس,faits-divers,3,2020-08-15 00:48:00,"الاحتجاز والاغتصاب يورطان شابا في ""ابا محمد""",https://www.hespress.com/faits-divers/481186.html
700,481197, هسبريس من الناظور ,faits-divers,1,2020-08-15 03:34:00,"الأمن يتصدى لتهريب ""الشيرا"" بميناء بني أنصار",https://www.hespress.com/faits-divers/481197.html
701,481134,إبراهيم مغراوي من مراكش ,faits-divers,11,2020-08-15 06:19:00,هتك عرض قاصر يجر شابا إلى قضاء اليوسفية,https://www.hespress.com/faits-divers/481134.html
702,481165,رشيد بيجيكن من أكادير,faits-divers,4,2020-08-15 08:03:00,"إيداع ""مدير مصالح"" جماعة كلميم سجن آيت ملول",https://www.hespress.com/faits-divers/481165.html
703,482819,عبد الكريم هرواش من الناظور,regions,0,2020-09-01 01:45:00,"جهة الشرق تسجل 16 إصابة جديدة بـ""كوفيد - 19""",https://www.hespress.com/regions/482819.html
704,482823,مصطفى البكار من تزنيت,regions,0,2020-09-01 02:10:00,مديرية التربية الوطنية تنفي إغلاق مقر سيدي إفني,https://www.hespress.com/regions/482823.html
705,478514,هسبريس من تطوان,art-et-culture,28,2020-07-19 11:10:00,توقف الأعراس يرمي موسيقيين في ردهات القهر,https://www.hespress.com/art-et-culture/478514.html
706,475356,هسبريس من الرباط,marocains-du-monde,10,2020-06-19 12:38:00,استئناف تدريجي لخدمات قنصلية فرنسا بالمغرب,https://www.hespress.com/marocains-du-monde/475356.html
707,475167,هسبريس - نورالدين إكجان,marocains-du-monde,42,2020-06-17 19:00:00,"ملف مقتل ""فلويد المغربي"" يصل إلى مكتب رئيس الحكومة الإسبانية",https://www.hespress.com/marocains-du-monde/475167.html
708,480281,هسبريس من الرباط,economie,11,2020-08-05 19:20:00,"""الفيدرالية الوطنية"" تتشبّث بإضراب ""النقل السياحي""",https://www.hespress.com/economie/480281.html
709,480179,هسبريس من الرباط,economie,78,2020-08-05 09:00:00,هل يفتحُ المغرب حدوده الجوّية أمام أوروبا لإنقاذِ موسم السّياحة؟‬,https://www.hespress.com/economie/480179.html
710,482996,هسبريس - عبد الإله شبل,societe,54,2020-09-03 02:00:00,"محامون يشْكون ""أضرار كورونا"" ويطالبون الهيئات بالدعم المالي",https://www.hespress.com/societe/482996.html
711,482990,هسبريس من الرباط,societe,21,2020-09-02 21:00:00,"تقنيات كورية متطورة تدعم المغرب للحد من انتشار ""جائحة كورونا""",https://www.hespress.com/societe/482990.html
712,482994,هسبريس – محمد لديب,societe,46,2020-09-03 05:45:00,"وزارة التربية تتيح للتلاميذ ولوجا مجانيا إلى دروس ""التعليم عن بعد""",https://www.hespress.com/societe/482994.html
713,481842,هسبريس - محمد الراجي,economie,94,2020-08-22 10:00:00,وزير سابق يقدم معطيات صادمة عن ضعف جهاز مراقبة الشغل,https://www.hespress.com/economie/481842.html
714,479348,هسبريس من الرباط,medias,17,2020-07-26 22:00:00,"رصيف الصحافة: مراسلة تدعو إلى ""الإفراج"" عن شهادة الباكالوريا",https://www.hespress.com/medias/479348.html
715,482710,هسبريس - محمد لديب,economie,46,2020-08-31 10:00:00,هل يبطل مجلس المنافسة اتفاق شركات التأمين بشأن حوادث السير؟,https://www.hespress.com/economie/482710.html
716,479454,هسبريس من الرباط,medias,31,2020-07-27 22:00:00,رصيف الصحافة: تضحيات شغيلة الصحة تستوجب صرف تحفيزات,https://www.hespress.com/medias/479454.html
717,479208,هسبريس من الرباط,medias,92,2020-07-25 22:00:00,"رصيف الصحافة: حكومة العثماني تقترب من تفعيل ""صندوق الزكاة""",https://www.hespress.com/medias/479208.html
718,482529,هسبريس من الرباط,economie,24,2020-08-28 19:41:00,عملية اختلاس تطال معطيات بطائق بنكية مغربية,https://www.hespress.com/economie/482529.html
719,482394,هسبريس من الرباط,economie,84,2020-08-28 08:00:00,"شركات التأمين تثير الجدل بقرار حول ""توحيد خلوص حوادث السير""",https://www.hespress.com/economie/482394.html
720,482373,هسبريس من الرباط,economie,12,2020-08-27 13:04:00,شبكة اقتصادية تنتقد حل مكتب التسويق والتصدير,https://www.hespress.com/economie/482373.html
721,482396,هسبريس - يوسف لخضر,economie,140,2020-08-27 15:00:00,"التخلي عن خدمات 95 ربانا يُكلف شركة ""لارام"" 36 مليار سنتيم",https://www.hespress.com/economie/482396.html
722,481220,هسبريس - وائل بورشاشن,medias,1,2020-08-15 05:05:00,"""مؤسسة كلوني"" تنبش محاكمة هاجر الريسوني",https://www.hespress.com/medias/481220.html
723,481153,هسبريس - عبد الرحيم العسري,medias,5,2020-08-15 10:30:00,"مقر جديد يحتضن المجموعة الإعلامية لـ""الاستقلال""",https://www.hespress.com/medias/481153.html
724,481101,هسبريس من الرباط,medias,41,2020-08-13 22:00:00,"رصيف الصحافة: شهادات صادمة عن ""وفيات كورونا"" بأقسام الإنعاش",https://www.hespress.com/medias/481101.html
725,480997,هسبريس من الرباط,medias,44,2020-08-12 22:00:00,"رصيف الصحافة: زفاف في ""كورونا"" يُدخل عروسين ""القفص الحديدي""",https://www.hespress.com/medias/480997.html
726,480506,هسبريس من الرباط,medias,28,2020-08-07 22:00:00,رصيف الصحافة: حركة انتقالية تهمّ المصالح الأمنية في المغرب,https://www.hespress.com/medias/480506.html
727,480342,هسبريس من الرباط (كاريكاتير: مبارك بوعلي),medias,0,2020-08-07 00:07:00,"مجلس ""هاكا"" يقيّم تجربة الإعلام في ""زمن كورونا""",https://www.hespress.com/medias/480342.html
728,480558,هسبريس من الرباط,medias,0,2020-08-09 03:27:00,فحوصات تبعد كورونا عن استوديوهات عين الشق,https://www.hespress.com/medias/480558.html
729,480413,هسبريس من الرباط,medias,20,2020-08-06 22:00:00,"رصيف الصحافة: ""الحجر المنزلي"" ينتظر مصابين بفيروس ""كورونا""",https://www.hespress.com/medias/480413.html
730,480607,هسبريس من الرباط,medias,1,2020-08-09 07:14:00,"دبي تحتضن ""منتدى الإعلام"" في أكتوبر القادم",https://www.hespress.com/medias/480607.html
731,480895,هسبريس من الرباط,medias,18,2020-08-11 22:00:00,"رصيف الصحافة: ""اختبار كورونا"" ينتظر النواب قبل ولوج البرلمان",https://www.hespress.com/medias/480895.html
732,480796,هسبريس من الرباط,medias,34,2020-08-10 22:00:00,"رصيف الصحافة: ""البيجيدي"" ينتقد تعتيم التدابير الاحترازية في طنجة",https://www.hespress.com/medias/480796.html
733,480693,هسبريس من الرباط,medias,36,2020-08-09 22:00:00,"رصيف الصحافة: الداخلية تراقب أماكن بيع وتخزين ""المواد المتفجرة""",https://www.hespress.com/medias/480693.html
734,481560,هسبريس من الرباط,medias,20,2020-08-18 22:01:00,رصيف الصحافة: إدانة حبسية تطوي ملف شبكة الإجهاض السري,https://www.hespress.com/medias/481560.html
735,481374,هسبريس من الرباط,medias,13,2020-08-16 22:00:00,"رصيف الصحافة: ""الأوروبول"" تشيد بجهود المغرب لمحاربة المخدرات",https://www.hespress.com/medias/481374.html
736,481649,هسبريس من الرباط,medias,16,2020-08-19 22:00:00,"رصيف الصحافة: مستشفى جديد بقاعدة بنجرير لعلاج مرضى ""كورونا""",https://www.hespress.com/medias/481649.html
737,481467,هسبريس من الرباط,medias,59,2020-08-17 22:00:00,"رصيف الصحافة: المغرب يستعد لحالة ""الطوارئ الصحية القصوى""",https://www.hespress.com/medias/481467.html
738,480956,هسبريس من الرباط,medias,0,2020-08-12 17:10:00,"""اليونسكو"" تعمل على فتح كرسي بمعهد الإعلام بالرباط",https://www.hespress.com/medias/480956.html
739,481791,هسبريس من الرباط,medias,11,2020-08-21 15:05:00,منشور زائف حول الامتحانات يستغل هوية هسبريس,https://www.hespress.com/medias/481791.html
740,483053,هسبريس من الرباط,faits-divers,3,2020-09-03 14:17:00,"الأمن يكذب إشاعة ""عصابات ألواح ترقيم السيارات""",https://www.hespress.com/faits-divers/483053.html
741,481812,هسبريس من الرباط,medias,46,2020-08-21 23:08:00,"منابر عربية ترصد ""الحزم الملكي"" أمام تفشي ""كورونا"" في المغرب",https://www.hespress.com/medias/481812.html
742,483104,رشيد بيجيكن من أكادير,faits-divers,0,2020-09-04 03:30:00,حجز مخدرات وأسلحة بيضاء قرب اشتوكة آيت باها,https://www.hespress.com/faits-divers/483104.html
743,483081,رشيد بيجيكن من أكادير ,faits-divers,1,2020-09-03 23:05:00,تحقيق قضائي في انتحار فتاة شنقا نواحي اشتوكة,https://www.hespress.com/faits-divers/483081.html
744,483127,رشيد الكويرتي من فاس,faits-divers,4,2020-09-04 08:13:00,"درك ""بوفكران"" يطيح بزعيم عصابة لسرقة السيارات",https://www.hespress.com/faits-divers/483127.html
745,483098,جمال سماحي من تطوان ,faits-divers,17,2020-09-04 10:10:00,"جمعية تستنكر ""القتل العمد"" للدلافين بسواحل المغرب",https://www.hespress.com/faits-divers/483098.html
746,483158,مصطفى البكار من تزنيت,faits-divers,1,2020-09-04 13:53:00,"""الأطلسي"" يلفظ جثة شاب بشاطئ سيدي بولفضايل",https://www.hespress.com/faits-divers/483158.html
747,483185,هسبريس من الرباط,faits-divers,11,2020-09-04 17:20:00,القوات المساعدة تحبط عملية تهريب دولي للمخدرات,https://www.hespress.com/faits-divers/483185.html
748,483164,عبد الكريم هرواش من الناظور,faits-divers,0,2020-09-04 13:05:00,"ثغر مليلية يسجّل ثالث وفاة بفيروس ""كوفيد-19""",https://www.hespress.com/faits-divers/483164.html
749,483171,هسبريس من الرباط,faits-divers,2,2020-09-04 15:01:00,شرطة البيضاء تتصدى لترويج أقراص طبية مخدرة,https://www.hespress.com/faits-divers/483171.html
750,483055,هسبريس - محمد الراجي,faits-divers,91,2020-09-03 20:00:00,أيادي المشعوذين تُمْعِنُ في تعذيب القطط .. هلاك وإنقاذ بأعجوبة,https://www.hespress.com/faits-divers/483055.html
751,483189,هسبريس من القصر الكبير,faits-divers,0,2020-09-04 18:15:00,شرطة القصر الكبير توقف متورطا في جريمة قتل,https://www.hespress.com/faits-divers/483189.html
752,483201,رشيد بيجيكن من أكادير ,faits-divers,6,2020-09-04 19:58:00,الغموض يلف العثور على جثة سيدة في بيوكرى,https://www.hespress.com/faits-divers/483201.html
753,483153,حميد رزقي من الفقيه بنصالح,faits-divers,1,2020-09-05 00:20:00,درك ولد زيدوح يفكك عصابة متخصصة في السرقة,https://www.hespress.com/faits-divers/483153.html
754,483224,هسبريس من الرباط,faits-divers,47,2020-09-04 22:50:00,"الفرقة الوطنية تدخل على الخط في قضية قناة ""فيروسات بلا حدود""",https://www.hespress.com/faits-divers/483224.html
755,483213,رشيد بيجيكن من اشتوكة آيت باها,faits-divers,7,2020-09-05 02:22:00,الدرك يوقف متورطين في اعتداء نواحي اشتوكة,https://www.hespress.com/faits-divers/483213.html
756,483217,إبراهيم مغراوي من مراكش,faits-divers,8,2020-09-05 03:50:00,حملة توقف مئات الدراجات النارية بضواحي الحوز,https://www.hespress.com/faits-divers/483217.html
757,483225,أيوب صدور من تطوان ,faits-divers,8,2020-09-05 01:48:00,‪وفاة رضيعة تثير غضبا ضواحي إقليم شفشاون‬,https://www.hespress.com/faits-divers/483225.html
758,483272,إبراهيم مغراوي من مراكش,regions,5,2020-09-05 23:30:00,وزارة التربية تنفي تأجيل التعليم الحضوري بمراكش,https://www.hespress.com/regions/483272.html
759,483228,هسبريس من الناظور (صور: محمد العبوسي),faits-divers,6,2020-09-05 08:01:00,العثور على جثّة متحلّلة داخل سيّارة بمدينة النّاظور,https://www.hespress.com/faits-divers/483228.html
760,483270,ياسين أوشن,regions,3,2020-09-05 22:25:00,"شبكة تحسّس الساكنة بخطورة ""كورونا"" في بومية",https://www.hespress.com/regions/483270.html
761,483283,جمال سماحي من تطوان ,regions,0,2020-09-05 23:34:00,9 متطوعين بالهلال الأحمر ضحية لكورونا في طنجة,https://www.hespress.com/regions/483283.html
762,483233,هسبريس من الرباط,faits-divers,27,2020-09-05 10:25:00,تدخلات أمنية تضبط مليون قنينة مشروبات كحولية,https://www.hespress.com/faits-divers/483233.html
763,483262,رشيد بيجيكن من أكادير ,regions,0,2020-09-06 02:11:00,أكاديمية كلميم تتابع تفاصيل الدخول المدرسي الجديد,https://www.hespress.com/regions/483262.html
764,483265, إبراهيم مغراوي من مراكش,regions,6,2020-09-06 01:50:00,سجن الأوداية ينفي انتهاك حقوق نزيلات تونسيات,https://www.hespress.com/regions/483265.html
765,483294,إبراهيم الحافظون من سطات,regions,1,2020-09-06 00:45:00,"""جامعة سطات"" تطلق الاختبارات الأسبوع المقبل",https://www.hespress.com/regions/483294.html
766,483242,هسبريس من الرباط,regions,0,2020-09-06 03:03:00,"""الطرق السيارة"" توضح وضع ""بدال شرق برشيد""",https://www.hespress.com/regions/483242.html
767,483305,محمد آيت حساين,regions,2,2020-09-06 05:26:00,"""منجم إميضر"" يسجل 23 إصابة جديدة بـ""كورونا""",https://www.hespress.com/regions/483305.html
768,483250,هسبريس من الرباط,regions,5,2020-09-06 06:33:00,"""ابن طفيل"" تتقدّم في تصنيف عالمي جديد للجامعات",https://www.hespress.com/regions/483250.html
769,483257,إبراهيم مغراوي من مراكش,regions,6,2020-09-06 09:15:00,إعدادية تشكو مخلفات مطرح عشوائي في الرحامنة,https://www.hespress.com/regions/483257.html
770,483313,ياسين أوشن,regions,11,2020-09-06 03:40:00,نقابات تطلب تأجيل الدخول المدرسي بإقليم أزيلال,https://www.hespress.com/regions/483313.html
771,483338,حميد رزقي من الفقيه بنصالح,regions,1,2020-09-06 12:52:00,مدرسة فرعية آيلة للسقوط تقلق نشطاء في أزيلال,https://www.hespress.com/regions/483338.html
772,483390,هسبريس من الدار البيضاء,regions,1,2020-09-06 13:36:00,جمعيات تساعد السلطات لتأمين الدخول المدرسي,https://www.hespress.com/regions/483390.html
773,483339,هسبريس من الرباط,regions,3,2020-09-06 14:05:00,زخات رعدية وحرارة مرتفعة تهم مناطق في المملكة‎,https://www.hespress.com/regions/483339.html
774,483307,هسبريس من الرباط,regions,51,2020-09-06 12:00:00,مراكش .. المدينة السياحية المغربية الأولى تئن تحت وطأة الوباء,https://www.hespress.com/regions/483307.html
775,483353,رشيد الكويرتي من فاس,regions,33,2020-09-06 16:00:00,مغاربة يهزمون كورونا دون معرفة الإصابة بالمرض,https://www.hespress.com/regions/483353.html
776,483361,رشيد الكويرتي من فاس,regions,6,2020-09-06 16:38:00,"فاس مكناس تسجل 42 وفاة بـ""كورونا"" في أسبوع",https://www.hespress.com/regions/483361.html
777,483335,محمد ايت حساين,regions,3,2020-09-06 17:20:00,السلطة تبدأ تطبيق تدابير صارمة في بومالن دادس,https://www.hespress.com/regions/483335.html
778,482907,ميمون ام العيد,regions,14,2020-09-06 16:00:00,مكتبة أَلْمُو .. مشروع يغرس ثقافة القراءة في الناشئة ناحية زاكورة,https://www.hespress.com/regions/482907.html
779,482198,هسبريس - وائل بورشاشن,art-et-culture,17,2020-08-25 21:00:00,سيدة المسرح المغربي ثريا جبران .. مسارات عديدة والفقيدة واحدة,https://www.hespress.com/art-et-culture/482198.html
780,482164,هسبريس من الرباط,art-et-culture,0,2020-08-26 00:50:00,"غازي تكتب نصوص نساء على ""كرسي الاعتراف""",https://www.hespress.com/art-et-culture/482164.html
781,482166,هسبريس من الرباط,art-et-culture,0,2020-08-26 03:46:00,"""تجليات المكان الشعري"" تبحث في تجربة الرباوي",https://www.hespress.com/art-et-culture/482166.html
782,482205,هسبريس من شفشاون,art-et-culture,1,2020-08-26 06:13:00,علوش يعرض لوحاته في المركز الثقافي بالجبهة,https://www.hespress.com/art-et-culture/482205.html
783,482209,هسبريس من الرباط,art-et-culture,5,2020-08-25 23:30:00,بيت الشعر في المغرب يعدد مناقب الفنانة ثريا جبران,https://www.hespress.com/art-et-culture/482209.html
784,482168,هسبريس من الرباط,art-et-culture,15,2020-08-26 08:40:00,مئات الفنانين يثمنون المكاسب الحقوقية في المغرب,https://www.hespress.com/art-et-culture/482168.html
785,482260,هسبريس ـ مُتابعة,art-et-culture,4,2020-08-26 14:10:00,وزير الثقافة الفلسطيني يعدد شيم الراحلة ثريا جبران,https://www.hespress.com/art-et-culture/482260.html
786,482202,ياسين عدنان,art-et-culture,19,2020-08-26 07:00:00,"الفنانة ثريا جبران .. فارسة الخشبة و""الثريا المنيرة للمسرح المغربي""",https://www.hespress.com/art-et-culture/482202.html
787,482319,هسبريس - وائل بورشاشن,art-et-culture,12,2020-08-26 21:15:00,عائلة الراحل محمد وقيدي تهدي كتبه للمكتبة الوطنية,https://www.hespress.com/art-et-culture/482319.html
788,482234,هسبريس من الرباط,art-et-culture,1,2020-08-26 15:10:00,"محام يوضح دوره في الصلح بـ""تعاضدية الفنانين""",https://www.hespress.com/art-et-culture/482234.html
789,482313,هسبريس - وائل بورشاشن,art-et-culture,12,2020-08-27 06:55:00,من الشّرق والغرب .. كتاب يجمع أكاديميين حول إرث الرّاحل الخطيبي,https://www.hespress.com/art-et-culture/482313.html
790,482392,هسبريس من الرباط,art-et-culture,1,2020-08-28 03:30:00,"الكاتب محمد فولا يرفع الستار عن ""أشلاء ذاكرة""",https://www.hespress.com/art-et-culture/482392.html
791,482437,رشيد بيجيكن من أكادير ,art-et-culture,5,2020-08-28 09:31:00,برقية تعزية ملكية تنعي الفنان الأمازيغي أحمد بادوج,https://www.hespress.com/art-et-culture/482437.html
792,482536,هسبريس - وائل بورشاشن,art-et-culture,4,2020-08-29 01:15:00,الراحلة ثريا جبران والمسرح .. مبادئ وإرادات خيِّرَة لصناعة الجمال,https://www.hespress.com/art-et-culture/482536.html
793,482523,هسبريس من الرباط,art-et-culture,7,2020-08-29 07:50:00,"فنانو المطاعم يطالبون ""وزارة الثقافة"" بالتدخل العاجل",https://www.hespress.com/art-et-culture/482523.html
794,482470,محمّد محمّد الخطّابي*,art-et-culture,9,2020-08-29 03:45:00,ذكرى مصرع الشاعر الإسباني لوركا .. عندما تُقرع نواقيس الموت,https://www.hespress.com/art-et-culture/482470.html
795,482629,هسبريس من الرباط ,art-et-culture,11,2020-08-30 01:00:00,"""المركز السينمائي"" يواكب الوضع الصحي للمخرج محمد إسماعيل",https://www.hespress.com/art-et-culture/482629.html
796,482612,هسبريس - وائل بورشاشن,art-et-culture,9,2020-08-30 11:00:00,"""مكتبة الشّافعي"".. مبادرة تفك العزلة الثقافية عن قرية أولاد حمزة",https://www.hespress.com/art-et-culture/482612.html
797,481615,هسبريس - عبد السلام الشامخ,politique,32,2020-08-20 09:00:00,الانقلابُ يحتّم على المغرب إعادة ترتيب أوراقه الدبلوماسية في مالي,https://www.hespress.com/politique/481615.html
