,article_id,author,category,number_of_comments,timestamp,title,article_link
0,478909,هسبريس من الرباط,art-et-culture,0,2020-07-23 03:50:00,"مجلة ""بيت الشعر"" تُفرد عددًا خاصّا بأمجد ناصر",https://www.hespress.com/art-et-culture/478909.html
1,478958,هسبريس - محمد الراجي,art-et-culture,13,2020-07-23 03:45:00,"الفن يتحدى تداعيات جائحة ""كوفيد - 19"" في منتدى أصيلة الثقافي",https://www.hespress.com/art-et-culture/478958.html
2,479014,هسبريس - نورالدين إكجان,politique,59,2020-07-24 16:00:00,"تشبث المعارضة بحظر الرموز الدينية ينذر بمواجهة مع ""البيجيدي‬""",https://www.hespress.com/politique/479014.html
3,478839,هسبريس من الرباط,politique,58,2020-07-22 05:00:00,حزب العدالة والتنمية يطلب رفع العتبة الانتخابية إلى 6 في المائة,https://www.hespress.com/politique/478839.html
4,479294, هسبريس - عبد السلام الشامخ,politique,91,2020-07-27 09:00:00,"""رفاق منيب"" يتجاوزون هاجس الاندماج ويهيّئون لانتخابات 2021",https://www.hespress.com/politique/479294.html
5,482050,هسبريس من طنجة,faits-divers,5,2020-08-24 13:15:00,توقيف مروج مخدرات وحجز كوكايين بمدينة طنجة‎,https://www.hespress.com/faits-divers/482050.html
6,478803,هسبريس - عبد الرحيم العسري,politique,150,2020-07-22 08:00:00,"المعارضة تقترح محاربة ""العزوف الانتخابي"" بامتيازات للمصوتين",https://www.hespress.com/politique/478803.html
7,478884,هسبريس - عبد الرحيم العسري (صور: منير امحيمدات),politique,107,2020-07-22 15:00:00,المعارضة تصف التصويت الإجباري بالكارثة وترهن التحالف بالصناديق,https://www.hespress.com/politique/478884.html
8,482072,هسبريس من الرباط,faits-divers,2,2020-08-24 15:15:00,الشرطة القضائية ببني ملال تفكك شبكة للتهجير السري‎,https://www.hespress.com/faits-divers/482072.html
9,482093,حميد رزقي من الفقيه بن صالح,faits-divers,5,2020-08-24 17:10:00,"انتشال جثة ""شابة معاقة"" من بحيرة بين الويدان",https://www.hespress.com/faits-divers/482093.html
10,476077,هسبريس من الرباط,medias,13,2020-06-25 22:40:00,"""مومو مورنينغ شو"" يعود بعد الحجر داخل الإذاعة",https://www.hespress.com/medias/476077.html
11,476947,هسبريس من الرباط,medias,66,2020-07-03 22:00:00,"رصيف الصحافة: هل يتغلب المغرب على ""كوفيد-19"" في أسبوعين؟",https://www.hespress.com/medias/476947.html
12,476949,هسبريس - محمد الراجي (صور: منير محيمدات),medias,4,2020-07-03 22:40:00,السلطات تمنع وقفة تضامنية مع سليمان الريسوني,https://www.hespress.com/medias/476949.html
13,476965,هسبريس من الرباط ,medias,2,2020-07-04 03:39:00,"""الإذاعة والتلفزة"" تواكب ""كورونا"" بـ19 ألف ساعة",https://www.hespress.com/medias/476965.html
14,481031,هسبريس من الرباط,economie,22,2020-08-13 17:00:00,"""جبهة إنقاذ"" تربط السيادة الطاقية للمغرب بإعادة تشغيل ""سامير""",https://www.hespress.com/economie/481031.html
15,477037,هسبريس من الرباط,medias,55,2020-07-04 22:00:00,رصيف الصحافة: الملك يلقي خطاب ذكرى عيد العرش من تطوان,https://www.hespress.com/medias/477037.html
16,475172,هسبريس من الرباط,art-et-culture,2,2020-06-20 04:00:00,"هل تصالح جائحة ""كورونا"" الباحثين المغاربة مع ""النّشر الرقمي""؟",https://www.hespress.com/art-et-culture/475172.html
17,481018,هسبريس - أمال كنين,economie,28,2020-08-13 20:29:00,المغرب يتصدر دول إفريقيا في إنتاج الجزر واللفت,https://www.hespress.com/economie/481018.html
18,480870,هسبريس - يوسف لخضر,economie,16,2020-08-14 03:00:00,"خبير يطرح ثلاثة توجهات لتجاوز تداعيات أزمة ""كورونا"" بالمغرب",https://www.hespress.com/economie/480870.html
19,480953,هسبريس من الرباط,economie,22,2020-08-14 01:00:00,"أزمة ""كوفيد-19"" تهدد بتفاقم معدلات البطالة في المجتمع المغربي‬",https://www.hespress.com/economie/480953.html
20,481012,هسبريس - يوسف لخضر,economie,37,2020-08-13 21:00:00,"هل تتربّص ""جيوب المقاومة"" بمشروع إصلاح المؤسسات العمومية؟",https://www.hespress.com/economie/481012.html
21,481152,هسبريس من الرباط,economie,72,2020-08-14 15:00:00,المغرب يتصدّر شمال إفريقيا والشرق الأوسط في صناعة السيارات,https://www.hespress.com/economie/481152.html
22,475459,هسبريس من الرباط,art-et-culture,6,2020-06-21 04:00:00,فيديريكو كورينتي .. مُستعرِب إسباني غاص في درر اللغة الأندلسية‬,https://www.hespress.com/art-et-culture/475459.html
23,475413,هسبريس - محمد الراجي ,art-et-culture,14,2020-06-20 21:00:00,غياب ملاءمة مدونة الشغل وقانون الفنان يعصف بحقوق مبدعين,https://www.hespress.com/art-et-culture/475413.html
24,475177,هسبريس من الرباط,art-et-culture,9,2020-06-21 07:00:00,"""مرثية السور الغربي"" تتوّج ابتسام الجوهري في مسابقة أشعار وأوتار",https://www.hespress.com/art-et-culture/475177.html
25,475617,هسبريس من الرباط,art-et-culture,0,2020-06-21 20:49:00,"""قصة الفروسية"" تعيد افتتاح متحف اللوفر بأبوظبي",https://www.hespress.com/art-et-culture/475617.html
26,475629,هسبريس - وائل بورشاشن,art-et-culture,16,2020-06-21 23:10:00,أنغام الطقطوقة الجبلية تجمع 69 فنانا من العالم,https://www.hespress.com/art-et-culture/475629.html
27,475650,هسبريس من الرباط,art-et-culture,0,2020-06-22 07:23:00,"""أجراس الوباء"" يستطلع إنسانية ""ما بعد كورونا""‎",https://www.hespress.com/art-et-culture/475650.html
28,475771,هسبريس من الرباط,art-et-culture,5,2020-06-23 03:00:00,"مغربي وسودانية يُطلقان رواية ""فيسبوكية"" مشتركة عن نهاية العالم",https://www.hespress.com/art-et-culture/475771.html
29,475493,هسبريس - وائل بورشاشن,art-et-culture,5,2020-06-22 12:00:00,"نقابة الفنانين تدعو إلى ""إجراءات سليمة"" للعودة إلى مواقع التصوير",https://www.hespress.com/art-et-culture/475493.html
30,475692,هسبريس - محمد الراجي,art-et-culture,9,2020-06-23 01:00:00,"سعيد المغربي يضيء ""بيت ياسين"" بومضات من زمن الفن الملتزم",https://www.hespress.com/art-et-culture/475692.html
31,475805,هسبريس من الرّباط,art-et-culture,0,2020-06-24 09:45:00,"مسابقة مسرحية عن بعد تتحدى ""الحَجر الصحي""",https://www.hespress.com/art-et-culture/475805.html
32,475727,رشيد الكويرتي من فاس,art-et-culture,17,2020-06-23 06:00:00,"شامة الزاز .. أيقونة ""الطقطوقة الجبلية"" تصارع المرض بتاونات",https://www.hespress.com/art-et-culture/475727.html
33,476175,هسبريس من الرباط,art-et-culture,2,2020-06-26 21:13:00,وزارة الثقافة تحدد تدابير عودة ممارسة الأنشطة,https://www.hespress.com/art-et-culture/476175.html
34,475961,هسبريس من الرباط,art-et-culture,3,2020-06-25 10:04:00,"""الحب ديني"" .. قطعة صوفية تجمع مغربيا وإيطاليا‎",https://www.hespress.com/art-et-culture/475961.html
35,476130,هسبريس - وائل بورشاشن,art-et-culture,2,2020-06-26 13:16:00,"""الثقافة المغربية"" ترى النور في ""نسخة إلكترونية""",https://www.hespress.com/art-et-culture/476130.html
36,476136,عز الدين الوافي*,art-et-culture,9,2020-06-27 02:40:00,مرور نصف قرن على السينما المغربية .. محطات للتأمل والتقييم,https://www.hespress.com/art-et-culture/476136.html
37,476084,هسبريس - وائل بورشاشن,art-et-culture,2,2020-06-26 10:44:00,"""المناهل"" تجرد حصيلة البحث التاريخي في المغرب",https://www.hespress.com/art-et-culture/476084.html
38,476191,أيوب صدور من تطوان,art-et-culture,1,2020-06-27 07:05:00,"""الفن الزين"" .. مبادرة تروج للفنون البصرية الرقمية",https://www.hespress.com/art-et-culture/476191.html
39,481224,هسبريس من الرباط,economie,10,2020-08-16 00:00:00,قيمة المبادلات بين المغرب والصين تبلغ مليار دولار بداية 2020,https://www.hespress.com/economie/481224.html
40,481288,هسبريس من الرباط,economie,16,2020-08-16 03:38:00,"تساؤلات تحيط بتأخر الدولة في استغلال صَهاريج مصفاة ""سامير""",https://www.hespress.com/economie/481288.html
41,476229,هسبريس - وائل بورشاشن,art-et-culture,48,2020-06-28 02:10:00,فنان عراقي مقيم في المغرب يناشد الملك للحصول على الجنسية,https://www.hespress.com/art-et-culture/476229.html
42,481236,هسبريس من الرباط,economie,53,2020-08-16 11:00:00,"تقرير يعدد مزايا ""أركان المغربي"" ويتوقع حضور منافسة إسرائيلية",https://www.hespress.com/economie/481236.html
43,481209,هسبريس من الرباط,economie,52,2020-08-16 11:05:00,فيدرالية جديدة تمثل سلسلة إنتاج الحليب في المغرب,https://www.hespress.com/economie/481209.html
44,481446,هسبريس من الرباط,economie,5,2020-08-17 19:17:00,"""هواوي نوفا 7"".. الجيل 5 وكاميرا بالذكاء الاصطناعي",https://www.hespress.com/economie/481446.html
45,481424,هسبريس من الرباط,economie,27,2020-08-17 15:00:00,"أجراء شركة ""لارام"" يترقبون قرار السلطات بشأن ""مخطط التسريح""",https://www.hespress.com/economie/481424.html
46,481442,هسبريس من الرباط,economie,8,2020-08-18 11:30:00,قرض أوروبي يقدم الدعم لاشتغال شركات بالمغرب,https://www.hespress.com/economie/481442.html
47,481445,هسبريس من الرباط,economie,16,2020-08-18 00:00:00,شروط جديدة تُنظم صُنع وتوضيب وبيع الدقيق المدعوم في المغرب,https://www.hespress.com/economie/481445.html
48,481564,هسبريس - محمد لديب,economie,1,2020-08-19 02:09:00,مهنيون: شبح الإفلاس يهدد مقاولات النقل الطرقي,https://www.hespress.com/economie/481564.html
49,481434,هسبريس ـ محمد لديب,economie,38,2020-08-18 12:00:00,"""كورونا"" يخفض تشغيل فنادق ومنتجعات مراكش بمعدلات قياسية",https://www.hespress.com/economie/481434.html
50,481572,هسبريس من الرباط,economie,13,2020-08-19 12:10:00,تراجع أثمان المواد الغذائية وارتفاع في المحروقات‎,https://www.hespress.com/economie/481572.html
51,481496,حسن الركاز من هولندا,economie,15,2020-08-18 13:20:00,طائرات إضافية للنقل الجوي بين المغرب وهولندا,https://www.hespress.com/economie/481496.html
52,481535,هسبريس - عبد السلام الشامخ,economie,39,2020-08-19 09:00:00,"""شبح"" التّقويم الهيكلي يطلّ مع ارتفاع اللجوء إلى الاقتراض الخارجي",https://www.hespress.com/economie/481535.html
53,476234,هسبريس - أمال كنين,marocains-du-monde,6,2020-06-28 09:23:00,المتاجرة بأطفال مغاربة في سوريا تعود إلى الواجهة‎,https://www.hespress.com/marocains-du-monde/476234.html
54,476354,هسبريس ـ مصطفى شاكري,marocains-du-monde,24,2020-06-29 11:00:00,"قضية مقتل ""جورج فلويد المغربي"" تصل إلى قبة البرلمان الإسباني‎",https://www.hespress.com/marocains-du-monde/476354.html
55,476553,هسبريس من الرباط,marocains-du-monde,86,2020-06-30 14:00:00,المغرب يزيد وتيرة الرحلات الجوية الاستثنائية لإعادة العالقين بالخارج‬,https://www.hespress.com/marocains-du-monde/476553.html
56,476685,هسبريس – نورالدين إكجان,marocains-du-monde,20,2020-07-01 16:00:00,"شكاوى مقتل ""فلويد المغربي"" تتحول إلى احتجاجات بألميريا الإسبانية",https://www.hespress.com/marocains-du-monde/476685.html
57,476608,هسبريس من واشنطن,marocains-du-monde,44,2020-07-01 00:00:00,مغاربة عالقون في أمريكا يتطلعون إلى موعد العودة إلى المملكة,https://www.hespress.com/marocains-du-monde/476608.html
58,476577,هسبريس من الرباط,marocains-du-monde,38,2020-07-01 13:00:00,"صور ""درون"" يونانية تجهض أحلام ""حراكة مغاربة"" في بلوغ أوروبا‬",https://www.hespress.com/marocains-du-monde/476577.html
59,476684,هسبريس من الرباط,marocains-du-monde,13,2020-07-02 01:15:00,آخر المغاربة العالقين في اليابان يعودون إلى الوطن‎,https://www.hespress.com/marocains-du-monde/476684.html
60,476589,هسبريس - محمد الراجي,marocains-du-monde,52,2020-07-01 08:00:00,"عشرات الآلاف من ""المغاربة العالقين"" يغادرون إلى دول المهجر",https://www.hespress.com/marocains-du-monde/476589.html
61,476694,هسبريس من الرباط,marocains-du-monde,35,2020-07-02 08:35:00,"""مرصد الشمال"" ينتقد إلغاء الحكومة ""عملية مرحبا""",https://www.hespress.com/marocains-du-monde/476694.html
62,476689,هسبريس من الرباط,marocains-du-monde,62,2020-07-02 09:00:00,استمرار إغلاق الحدود الجوية يعمق معاناة مغاربة عالقين في الجزائر‎,https://www.hespress.com/marocains-du-monde/476689.html
63,476767,هسبريس من الرباط,marocains-du-monde,12,2020-07-02 17:31:00,مغاربة عالقون في تونس يتشبثون بالعودة إلى الوطن,https://www.hespress.com/marocains-du-monde/476767.html
64,476806,هسبريس من الرباط,marocains-du-monde,14,2020-07-03 00:00:00,"ضعف التّنسيق بين المغرب وإسبانيا يؤزّم وضعية ""عاملات الفراولة""",https://www.hespress.com/marocains-du-monde/476806.html
65,477050,هسبريس - وائل بورشاشن,marocains-du-monde,16,2020-07-05 12:10:00,"""سوء إرشاد"" يعمّق معاناة مغاربة ""عالقين"" بالخارج",https://www.hespress.com/marocains-du-monde/477050.html
66,476843,هسبريس - محمد الراجي,marocains-du-monde,22,2020-07-03 07:00:00,"شكاوى ""التمييز"" ضد مئات المهاجرين المغاربة تلاحق حكومة مدريد",https://www.hespress.com/marocains-du-monde/476843.html
67,476933,جمال سماحي من تطوان ,marocains-du-monde,35,2020-07-05 17:00:00,معاناة عاملات الفراولة بإسبانيا تزداد بإغلاق الحدود وانتهاء العقود,https://www.hespress.com/marocains-du-monde/476933.html
68,477100,هسبريس من الرباط,marocains-du-monde,13,2020-07-05 17:10:00,مطار أكادير يستقبل 303 من المغاربة العالقين بكندا,https://www.hespress.com/marocains-du-monde/477100.html
69,483072,هسبريس من الرباط,regions,0,2020-09-04 04:07:00,توقعات أحوال الطقس اليوم الجمعة في المغرب,https://www.hespress.com/regions/483072.html
70,477151,هسبريس من الرباط,marocains-du-monde,43,2020-07-06 10:00:00,مغاربة عالقون بألمانيا يلتمسون إرجاعهم إلى البلاد,https://www.hespress.com/marocains-du-monde/477151.html
71,483125,جمال سماحي من تطوان ,regions,1,2020-09-04 04:40:00,"الحالات النشطة بـ""كورونا"" تصل إلى 100 في سبتة",https://www.hespress.com/regions/483125.html
72,477200,هسبريس من الرباط,marocains-du-monde,40,2020-07-06 13:00:00,الرباط تعيد 278 من المغاربة العالقين في 3 بلدان بمنطقة الخليج,https://www.hespress.com/marocains-du-monde/477200.html
73,483116,ياسين أوشن,regions,0,2020-09-04 06:07:00,"جهة بني ملال تُحصي 138 حالة ""شفاء كورونا""",https://www.hespress.com/regions/483116.html
74,477199,هسبريس من الرباط,marocains-du-monde,48,2020-07-06 21:00:00,"عالقون بإسطنبول يواجهون ""التّشرد"" بالمبيت أمام قنصلية المملكة",https://www.hespress.com/marocains-du-monde/477199.html
75,483063,هسبريس من الرباط,regions,28,2020-09-04 08:54:00,"مدارس خاصة تبتز الأسر وتغيّب ""شواهد التأمينات""",https://www.hespress.com/regions/483063.html
76,483128,إبراهيم مغراوي ,regions,2,2020-09-04 05:19:00,إقليم شيشاوة يشهد إطلاق مشاريع طرقية جديدة,https://www.hespress.com/regions/483128.html
77,483100,هسبريس من الرباط,regions,45,2020-09-04 09:00:00,"الأمن يكثّف مراقبة ""السّدود"" ويمنعُ ""تسلّل"" مواطنين من مدنٍ موبوءة",https://www.hespress.com/regions/483100.html
78,483068,هسبريس من الرباط,regions,1,2020-09-04 09:54:00,"ترميم بيوت تاريخية وسط ""قصر ألوكوم"" في طاطا",https://www.hespress.com/regions/483068.html
79,483174,هسبريس من تنغير,regions,2,2020-09-04 15:28:00,"""كوفيد-19"" يصيب نائبة رئيس محكمة في ورزازات",https://www.hespress.com/regions/483174.html
80,483122,إبراهيم مغراوي من مراكش ,regions,13,2020-09-04 11:24:00,"غياب تحاليل كورونا عن ""التعليم الخاص"" يثير جدلا",https://www.hespress.com/regions/483122.html
81,483110,إبراهيم مغراوي من مراكش,regions,2,2020-09-04 10:22:00,مديرية الحوز تستعد لاستقبال تلاميذ مناطق نائية,https://www.hespress.com/regions/483110.html
82,483181,رشيد الكويرتي من فاس,regions,8,2020-09-04 16:40:00,"تصنيف ""تايمز"" يبوئ جامعة فاس الصدارة وطنيا",https://www.hespress.com/regions/483181.html
83,483179,هسبريس من الرباط,regions,4,2020-09-04 17:05:00,السلطات المحلية تمنع التنقل بين خنيفرة ومريرت,https://www.hespress.com/regions/483179.html
84,483089,هسبريس - عبد الإله شبل,regions,46,2020-09-04 12:00:00,أسواق شعبية بالدار البيضاء ترفع أسعار الخضر في غياب المراقبة,https://www.hespress.com/regions/483089.html
85,483182,محمد ايت حساين,regions,4,2020-09-04 18:35:00,"فرض ""شهادة التنقل"" لدخول أو مغادرة إقليم ميدلت",https://www.hespress.com/regions/483182.html
86,483141,هسبريس من الرباط,regions,5,2020-09-04 19:20:00,مطالب بإغلاق مقهى للمخدرات والقمار بمدينة وجدة,https://www.hespress.com/regions/483141.html
87,483203,عبد الجواد الخنيفي من شفشاون,regions,3,2020-09-04 20:30:00,مديرية شفشاون تبسط مرتكزات الدخول المدرسي,https://www.hespress.com/regions/483203.html
88,483194,هسبريس من الرباط,regions,38,2020-09-04 19:00:00,"أزيد من 1500 إصابة بـ""كورونا"" تتوزع على سبع جهات بالمغرب",https://www.hespress.com/regions/483194.html
89,483162,هسبريس من الدار البيضاء,regions,2,2020-09-04 21:15:00,سلطات عمالة عين السبع ترفض عقد دورة عن بعد,https://www.hespress.com/regions/483162.html
90,483220,محمد ايت حساين,regions,2,2020-09-04 23:21:00,تفاصيل الحالة الوبائية في جهة درعة - تافيلالت,https://www.hespress.com/regions/483220.html
91,482820,إبراهيم مغراوي من مراكش,societe,32,2020-08-31 20:25:00,وزارة التربية تحدد موعد الامتحان الجهوي للباكالوريا,https://www.hespress.com/societe/482820.html
92,482761,هسبريس من الرباط,societe,38,2020-08-31 21:00:00,إغلاق المجال الجوي لأوروبا يحبط راغبين في الدراسة خارج المغرب,https://www.hespress.com/societe/482761.html
93,482773,إبراهيم مغراوي من مراكش,societe,37,2020-09-01 09:40:00,مدراء يخشون تهديد الدخول المدرسي لصحة التلاميذ,https://www.hespress.com/societe/482773.html
94,482830,هسبريس من الرباط,societe,33,2020-08-31 22:38:00,وزير التربية يطمئن أمهات وأولياء أمور التلاميذ,https://www.hespress.com/societe/482830.html
95,482749,هسبريس - أمال كنين,societe,2,2020-09-01 09:12:00,"""جامعة حقوق المستهلك"" تطلق حملة ""بدون كوفيد""",https://www.hespress.com/societe/482749.html
96,482781,هسبريس من الرباط,societe,13,2020-09-01 04:55:00,"طلبة ""معهد السّيارات"" ينشدون امتحانات ""عن بعد"" لتفادي ""كورونا""",https://www.hespress.com/societe/482781.html
97,482785,هسبريس من الرباط,societe,58,2020-08-31 23:30:00,"الشائعات تصاحب ""الدخول المدرسي"" والنقابات تطلب ""قرارات واضحة""",https://www.hespress.com/societe/482785.html
98,482769,هسبريس - عبد الإله شبل,societe,47,2020-09-01 01:30:00,"فرض ""غرامة الكمامة"" داخل المقاهي والمطاعم يثير حفيظة الزبائن",https://www.hespress.com/societe/482769.html
99,482791,هسبريس من الدار البيضاء,societe,43,2020-09-01 12:00:00,"""منظمات الطفولة"" تدعو إلى توخي الحذر لضمان دخول مدرسي آمن",https://www.hespress.com/societe/482791.html
100,482799,هسبريس من الرباط,societe,2,2020-09-01 10:25:00,جمعيات تدعو إلى إنقاذ ومساندة مستعملي المخدرات,https://www.hespress.com/societe/482799.html
101,482888,هسبريس من الرباط,societe,58,2020-09-01 16:00:00,"مؤشر توالد ""فيروس كورونا"" يتراجع .. والمغرب يُودع ""أسوأ شهر""",https://www.hespress.com/societe/482888.html
102,482873,هسبريس من الرباط,societe,38,2020-09-01 15:00:00,آيت الطالب يلقي تحسين أجور أطباء القطاع العام إلى وزارة المالية,https://www.hespress.com/societe/482873.html
103,482895,هسبريس من الرباط,societe,1,2020-09-01 16:36:00,"موسم ""التكوين المهني"" ينطلق ابتداء من 12 أكتوبر",https://www.hespress.com/societe/482895.html
104,482896,محمد ايت حساين,societe,5,2020-09-01 17:20:00,"تسجيل إصابة قائدين بفيروس ""كورونا"" بإقليم ميدلت",https://www.hespress.com/societe/482896.html
105,482893,هسبريس من الرباط,societe,46,2020-09-01 18:05:00,المغرب يسجل 1191 إصابة جديدة مؤكدة بكورونا خلال 24 ساعة,https://www.hespress.com/societe/482893.html
106,482914,هسبريس - أمال كنين (صور: سهيل الرميدي),societe,10,2020-09-01 20:00:00,تدابير الوقاية من الجائحة ترافق انطلاق الامتحانات الجامعية المؤجلة,https://www.hespress.com/societe/482914.html
107,482920,هسبريس من الرباط,societe,46,2020-09-01 19:00:00,"""وفيات كورونا"" في المغرب .. أثقل حصيلة يومية منذ بداية الجائحة",https://www.hespress.com/societe/482920.html
108,482889,هسبريس من الرباط,societe,22,2020-09-01 22:10:00,"قضاة مغاربة يطالبون بردع ""فيروسات بلا حدود""",https://www.hespress.com/societe/482889.html
109,482351,رشيد الكويرتي ,faits-divers,7,2020-08-26 23:09:00,حريق يدمر عشرات المركبات بمستودع جماعة أزرو,https://www.hespress.com/faits-divers/482351.html
110,482310,هسبريس من الناظور,faits-divers,6,2020-08-26 20:40:00,حادثة سير خطيرة تصرع السائق في نواحي النّاظور,https://www.hespress.com/faits-divers/482310.html
111,482869,هسبريس من الرباط,societe,79,2020-09-01 23:00:00,"""المتعاقدون"" ينتقدون تجاهل أمزازي ويستعدّون لـ""معركة التّوظيف""",https://www.hespress.com/societe/482869.html
112,482328,رشيد بيجيكن من أكادير ,faits-divers,13,2020-08-26 23:38:00,محاولة انتحار بتسلق عمود كهربائي تهز اشتوكة‬,https://www.hespress.com/faits-divers/482328.html
